{
  "date": "1981-06-28",
  "language": "ko",
  "source": "Radio Mir Medjugorje",
  "visionary": "Vicka Ivanković 외",
  "message": "성모님께서는 사람들이 믿고 신앙 안에서 인내하기를 바란다고 말씀하셨다.\n\n사제들에 대해 묻자 성모님께서는 믿음 안에서 굳세게 남아 신자들을 도와주기를 원하신다고 하셨다.\n\n“보지 않고도 믿는 사람은 복되다.”\n\n기도와 찬양 중 무엇을 더 좋아하시느냐는 질문에 성모님께서는 둘 다라고 답하셨다.\n\n성모님께서는 아무 말씀 없이 사랑의 눈길과 미소만 남기셨다가 사라지셨다.\n\n기도와 찬양 중 다시 나타나셔서 말씀하셨다.\n\n“보지 않은 사람들도 본 사람처럼 믿기를 바란다.”",
  "themes": ["faith", "prayer", "trust"],
  "liturgical_links": [],
  "media": {
    "tts_duration_sec": 35,
    "voice": "sunkyung"
  }
}
