{
  "language": "ko",
  "source": "Medjugorje Message Archive",
  "visionary": "평화의 모후 성모 마리아",
  "message": "1990년 8월 20일 메주고리예 성모님 메시지 (정리 중).",
  "themes": [
    "기도",
    "평화"
  ],
  "liturgical_links": [],
  "media": {
    "tts_duration_sec": 30,
    "voice": "sunkyung"
  },
  "date": "1990-08-20"
}