{
  "date": "1981-06-25",
  "language": "ko",
  "source": "Radio Mir Medjugorje",
  "visionary": "Ivanka Ivanković",
  "message": "여섯 명의 선견자들이 발현을 본 첫날이다. 언덕 위에서 성모님을 보았다.\n\n선견자들이 인사하자 성모님께서는 응답하셨다.\n\n이반카는 두 달 전에 돌아가신 어머니에 대해 물었고, 성모님께서는 그녀가 행복하며 당신과 함께 있다고 말씀하셨다.\n\n선견자들이 다시 오실지를 묻자, 성모님께서는 고개를 끄덕이셨다.\n\n미리아나는 표징을 청했고, 성모님께서는 미소로 응답하셨다.\n\n발현의 마지막에 성모님께서는 아이들에게 작별 인사를 하시며 하느님의 평화 안에 가라고 말씀하셨다.",
  "themes": ["peace"],
  "liturgical_links": [],
  "media": {
    "tts_duration_sec": 35,
    "voice": "sunkyung"
  }
}
