{
  "date": "1981-06-26",
  "language": "ko",
  "source": "Radio Mir Medjugorje",
  "visionary": "Ivanka Ivanković 외",
  "message": "발현 언덕에서 빛이 뿜어져 나오는 것을 보고 약 2천에서 3천 명의 사람들이 모였다.\n\n비츠카가 성모님께 성수를 뿌리며 말하였다. “당신이 동정 마리아님이시라면 우리와 함께 머무르시고, 아니라면 물러가 주세요.”\n\n성모님께서는 미소만 지으셨다.\n\n이반카가 물었다. “왜 이곳에 오셨습니까?”\n\n성모님께서는 말씀하셨다. “이곳에 많은 진실한 신자들이 있기 때문에 왔다. 회개를 위해, 온 세상의 화해를 위해 너희와 함께 있고자 한다.”\n\n발현이 끝난 후, 성모님께서는 눈물을 흘리시며 말씀하셨다.\n\n“평화, 평화, 평화! 화해하여라! 평화뿐이다!”\n\n“하느님과 화해하고, 서로 평화를 이루기 위해 믿고, 기도하며, 단식하고, 고해성사를 받아야 한다.”",
  "themes": ["peace", "conversion", "reconciliation"],
  "liturgical_links": [],
  "media": {
    "tts_duration_sec": 45,
    "voice": "sunkyung"
  }
}
