{
  "date": "1981-06-27",
  "language": "ko",
  "source": "Radio Mir Medjugorje",
  "visionary": "Jakov Čolo 외",
  "message": "성모님께서는 “찬미 예수님!” 하고 인사하셨다.\n\n야콥이 물었다. “프란치스코회 수사님들에게 무엇을 바라십니까?”\n\n성모님께서는 말씀하셨다. “믿음 안에서 인내하며, 다른 이들의 믿음을 보호하게 하여라.”\n\n선견자들이 표징을 청하자 성모님께서는 말씀하셨다.\n\n“나의 천사들아, 부당함을 두려워하지 말아라. 그런 일은 언제나 존재한다.”\n\n기도에 대해 묻자 성모님께서는 주님의 기도와 성모송, 영광송에 사도신경을 더해 바치라고 하셨다.\n\n발현을 마치시며 성모님께서는 말씀하셨다.\n\n“평화 안에 머물거라. 그리고 용기를 가져라.”",
  "themes": [
    "기도",
    "믿음",
    "perseverance"
  ],
  "liturgical_links": [],
  "media": {
    "tts_duration_sec": 40,
    "voice": "sunkyung"
  }
}