{
  "date": "1981-06-24",
  "language": "ko",
  "source": "Early Medjugorje Testimonies",
  "visionary": "Ivanka Ivanković 외",
  "message": "1981년 6월 24일 수요일, 크르니카 언덕 위에 고요하고 멀리서 빛나는 흰 실루엣이 나타났다. 처음에는 오후에, 그리고 다시 저녁 여섯 시경에 같은 모습이 보였다. 이 날의 체험은 곧 다가올 특별한 사건의 시작을 알리는 징표처럼 느껴졌다.",
  "themes": ["sign", "beginning"],
  "liturgical_links": [],
  "media": {
    "tts_duration_sec": 30,
    "voice": "sunkyung"
  }
}
